"By Sanny Jegillos, Team Leader, UNDP Disaster Risk Reduction in Asia and the Pacific","Disaster Management"
"On behalf of UNDP, I am honoured to speak at today’s opening ceremony of school tsunami drills campaign in Indonesia.","Disaster Management"
"The tsunami drills are part of a UNDP and Government of Japan project, BUT it is all of you here in Indonesia who have made them possible with your commitment and enthusiasm. I’d like to thank the school principals, faculty and administration, and of course the students for participating in this initiative. I’m also grateful for the presence of our partners – the Indonesian National Board for Disaster Management (NDMO), Ministry of National Education, the Consular General of Japan to Denpasar and the Red Cross – as this reaffirms your interest and engagement in this very important initiative.","Disaster Management"
"Indonesia is the first of 18 countries under this regional project, to plan and conduct the school drills. In my view, this is hardly surprising as this is the country in the Asia Pacific region that is a champion on Disaster Risk Reduction issues. As a country, you have turned the suffering that your people have faced into an opportunity to advocate for risk informed development, so that others will benefit. You know the importance of hazard risk for planning, for building and for growth. You have understood and embraced the importance of hazard awareness and preparedness so that the impact on the loss of lives and livelihoods is reduced.","Disaster Management"
"Today’s drills are part of your journey in ensuring that your most vulnerable, including children and those living in tsunami prone areas, are aware and prepared about how to respond in the event of a disaster. Lessons from the first drill will be shared with other countries in the region. There is much that they can learn from your experience and knowledge.  ","Disaster Management"
"The drills are not an end in themselves. They help test evacuation plans and improve preparedness. But you must conduct them regularly. Each year new students will enter your schools. Those who leave will take and spread their learning. Perhaps your students will become DRR experts in the future, or perhaps they will ensure that risk is integrated in the work they do. What better way to build a resilient future than building resilient generations?","Disaster Management"
"The moment students leave the school premises, the drills are no longer just about the school. The local administration, the traffic police, parents and the neighborhood – everyone becomes a part of this. The MOUs that you are signing this afternoon with eight hotels in the area show that even private enterprises play a role. What better way to build a whole of society approach than this?","Disaster Management"
"I’d like to conclude by saying how proud we are at UNDP to be supporting this initiative. We know that a lot of preparation has gone behind what we will observe today. And there’s much more to do. It is you who have the power to create a movement, a ripple effect of preparedness so that it’s not just a few schools and a few communities but that an entire nation is resilient.","Disaster Management"
"*The speech was given in August 2017 in Bali, Indonesia","Disaster Management"
"Solomon Islands - The first tsunami drill at schools in the Solomon Islands mobilized nearly 400 students and teachers, testing the schools’ emergency management plans and newly constructed evacuation routes.","Disaster Management"
"The tsunami evacuation drill was held in two schools - Titiana Community High School and Babanga Primary school, in the tsunami-prone Western Province. It was supported by the government of Solomon Islands and Japan, and the United Nations Development Program (UNDP).","Disaster Management"
"“During the 2007 Tsunami, 52 children and adults lost their lives. We did not know what a tsunami was or what to do. We are grateful for support of the Government of Japan and UNDP to help our communities and children to be better prepared for the future,” said Honorable George Lilo, member of the Provincial Assembly.","Disaster Management"
"The school tsunami preparedness project is supported by the Western Province Education Authority, Solomon Islands Red Cross-Gizo branch, the Seismology Division of MMERE and the NDMO, SI Meteorological Services, Climate Change Division of the Ministry of Environment, Climate Change and Disaster Management & Meteorology.","Disaster Management"
"Using images taken from the drones and stories gathered from the communities, the agencies in collaborations with the two schools banded together to collect data, and conduct a tsunami risk assessment. They also produced tsunami hazard maps, and identified evacuation routes and safe areas.","Disaster Management"
"The work resulted in the creation of new emergency evacuation plans, and construction of evacuation routes.","Disaster Management"
"It was recommended that schools set up internal siren systems to support early warning, build emergency exit doors, and display tsunami evacuation guides around the perimeter of the schools’ campus to ensure safe evacuation.","Disaster Management"
" “Our children have a lot to learn about being safe and being able to fend for themselves when threats exist. Children are “agents of change”, they will carry the safety message to their parents, friends, and entire community,” said  Director of the National Disaster Management Office, Mr. Loti Yates.","Disaster Management"
"UNDP Country Manager in the Solomon Islands, Ms Azusa Kubota, thanked the Government of Solomon Islands and Government of Japan for partnering with UNDP in this important initiative.","Disaster Management"
"“Globally, schools have been identified as an ideal venue for raising awareness on disaster risk reduction and strengthening preparedness amongst students, families and communities. It is wonderful to see not only school children and teachers, but also community members coming together to be part of today’s exercise,” said Ms. Azusa Kubota of UNDP","Disaster Management"
"With support from the government of Japan, UNDP is organizing 90 tsunami evacuation drills in 18 countries across Asia and the Pacific. The regional project “Strengthening School Preparedness for Tsunami” is active in Bangladesh, Cambodia, Fiji, Indonesia, Malaysia, Maldives, Myanmar, Pakistan, Papua New Guinea, Philippines, Samoa, Solomon Islands, Sri Lanka, Thailand, Timor Leste, Tonga, Vanuatu, and Vietnam.","Disaster Management"
"email: sandra.barrows@undp.org, tel: +677 27446 ext. 5527","Disaster Management"
"BANGKOK, 2 November 2017 (NNT) – Heavy rains with potential flash floods and landslides are currently hitting the southern region while the temperature in the upper part of the country will continue to drop. ","Disaster Management"
"Metrological Department (TMD) Director-General Wanchai Sakudomchai has said the southern region of Thailand is currently prevailed by monsoon season, with torrential rains expected over the next few days. ","Disaster Management"
"He said the TMD is now working with the Department of Disaster Prevention and Mitigation, and the Ministry of Interior, to timely notify the general public who might be affected from the weather and to prepare for response plans. ","Disaster Management"
"Areas along the east coast of the southern region should be prepared for the potential flash floods and landslides, especially at foothills and steep areas. ","Disaster Management"
"Meanwhile, the northern and northeastern regions are entering the winter season with the temperature continues to drop, while the weather in the central region is also getting chiller. Areas with winter climate should be particularly mindful of fire accidents due to strong winds which can intensify the flame, as well as fogs which could obstruct visibility. The general public are also advised to keep themselves healthy for the cold weather.","Disaster Management"
"National News Bureau & Public Relations : http://thainews.prd.go.th","Disaster Management"
"**NEW YORK, November 2, 2017** - Czech model and entrepreneur Petra Nemcova was yesterday officially recognized by Robert Glasser, Special Representative of the Secretary-General for Disaster Risk Reduction as World Tsunami Awareness Advocate in a ceremony held at the Japan Society in New York. ","Disaster Management"
"“Petra Nemcova not only survived the 2004 Indian Ocean tsunami in Thailand under terrible circumstances but also found a way to continue living, sharing her experience and putting her entrepreneurial spirit at the service of people affected by disasters. We are very pleased to recognize her efforts and acknowledge the incredible work she has undertaken to increase awareness on tsunami risk” said Robert Glasser. ","Disaster Management"
"On 26 December 2004, Petra Nemcova lost her fiancé Simon Atlee and suffered serious injuries when the Indian Ocean earthquake and subsequent tsunami struck in Thailand. She managed to survive holding on to a palm tree for eight hours until she was rescued by Thai civilians and airlifted to an inland hospital nearby. ","Disaster Management"
"“I was blessed to survive a near death experience in 2004 and this experience has taught me a huge lesson. We cannot control nature, but we can control the actions we take,” she says. ","Disaster Management"
"A few months after the Indian Ocean tsunami, Petra went back to Thailand and created “Happy Hearts Fund.” Her charity fund has now financed 165 safe and disaster resilient schools in disaster-affected communities in Peru, Mexico, Chile, Colombia, Haiti, Thailand, Indonesia, Philippines and Nepal to the benefit of over 100,000 children. ","Disaster Management"
"“We make sure that our schools respect the national building codes and are able to withstand a major earthquake, tsunami, or hurricane reinforcing their structure with steel bars along vulnerable and critical joints which allow them to withstand stronger forces,” she confirms. ","Disaster Management"
"Petra Nemcova who describes herself today as a model, philanthropist and entrepreneur admits to spending more than two third of her time raising money and rebuilding schools in disaster-affected countries. ","Disaster Management"
"“Last week, we were in Nepal, and we have just reopened five schools which were completely damaged after the 2015 earthquake. We are also involved in the reconstruction of five schools in Saint Martin and the rest of the Caribbean after hurricane Harvey hit the region.” ","Disaster Management"
"“I thank UNISDR for designating me as tsunami advocate which I accept with a great honor, and I will continue working on raising awareness on tsunami risks but my action today goes beyond tsunami prevention as I do believe that we can only save more lives in the future if we have a multi-hazard approach.” ","Disaster Management"
"The event at the Japan Society was co-organized by the permanent mission of Japan to the United Nations in New York, as well as the United Nations Development Programme (UNDP) and the United Nations Office for Disaster Risk Reduction (UNISDR). ","Disaster Management"
"The recognition of Petra Nemcova was announced after the opening remarks of Ambassador Koro Bessho, Permanent Representative of Japan followed by the interventions of Mr. František Ružička, Chef de Cabinet to the President of the 72nd Session of the UN General Assembly and Mr. Achim Steiner, Administrator of UNDP , who stressed the importance of integrating tsunami education in the curriculum of all children to better protect communities and to have more efficient early warning systems in place to save more lives in the future.","Disaster Management"
"AIDMI’s publication of Southasiadisasters.net on ‘Asian Early Warning Systems’ Launched at AMCDRR 2018 Side Event on Trans-Border Flood Early Warning System for Last Mile Connectivity, July 4, 2018 at Ulaanbaatar, Mongolia.","Disaster Management"
"This issue highlights the various aspects of early warning systems in India and South Asia such as leveraging social media for early warning, early warning in hilly regions, community participation in early warning, etc. This issue also highlights how there are gaps in effective implementation of people-centred, multi-hazard warning systems and what can be done to seamlessly integrate risk knowledge and impact information into such early warning mechanisms.","Disaster Management"
"This issue's contents includes: (i) Regional Collaboration for better Flood Early Warning and Resilience in India; (ii) Reducing the Fear of Getting Isolated during Disaster: Innovative solution by Oxfam India to ensure active participation of women in EWS for flood; (iii) Twitters and Early Warning Systems: Limits and Potential for India; (iv) Early Warning for Floods in South Asia; (v) Early Warning System (EWS) and Community Resilience to Floods; (vi) Planning Early Flood Warning Across India, Nepal and Bangladesh Rivers: A View; (vii) Role of EWS on Floods: A View from Bihar;  (viii) Community Perception Changes for Disaster Risk Reduction Management after Srinagar Floods–2014; and (ix) EWS for Floods: A View from Himalayas. ","Disaster Management"
"Theme: Early Warning System, Resilience, Disaster Risk Reduction.","Disaster Management"
"Jul 20, 2018-Residents of Inarba in Baudhimai Municipality, Rautahat, have been relieved after the Water Induced Disaster and River Control Division Office constructed 13 spurs in Lalbakaiya river to change its course away from the settlement.","Disaster Management"
"The river had damaged its embankment 10 days ago, spreading fear of flood in Inarba. Chief District Officer Govinda Prasad Rijal said there was no immediate flood threat to Inarba after the construction of spurs.","Disaster Management"
" “The course of the river has been redirected away from the settlement,” said Rijal.","Disaster Management"
"The 13 spurs were built by security personnel from Nepal Army, Nepal Police, Armed Police Force, and technicians from the division office.","Disaster Management"
"There are nearly 400 households living near the embankment of Lalbakaiya river. The local administration had advised these households to stay alert after the embankment was damaged by the flooded river.","Disaster Management"
"Inarba locals had long been facing the problems of flood and erosion from the Lalbakaiya river, said Raj Kumar Shreebastab, chief of the division office.","Disaster Management"
"“Changing the course of the river has saved the settlement,” he added.","Disaster Management"
"Last year, Lalbakaiya and Bagmati rivers in the district had breached their embankments at 31 places, putting dozens of villages in risk.","Disaster Management"
"**Landslide threat displaces 50 families**","Disaster Management"
"GORKHA: At least 50 families living in Ghairung village of Shahid Lakhan Rural Municipality-6, Gorkha, have been displaced due to a landslide threat in the area. Three people were killed after a landslide buried a house in Sahid Lakhan Rural Municipality-6 on Wednesday morning. In the wake of the incident, the families living in the area have relocated to safety. They have been living in makeshift camps.","Disaster Management"
"RAJBIRAJ: Floodwater has started to recede in Gobargadha settlement of Hanuman Nagar Kankalini Municipality-13, Saptari, with the decrease in the water level in the Saptakoshi river. The people displaced by the flood, however, are still unable to return to their homes. More than 70 people are still taking shelter at a local school building. Rain-swollen Saptakoshi had breached its banks and inundated Gobargadha on Saturday night.","Disaster Management"
"The United Nations Platform for Space-based Information for Disaster Management and Emergency Response (UN-SPIDER) has published a new booklet with examples of the programme's technical advisory support activities.","Disaster Management"
"UN-SPIDER was established in 2006 based on the recognition that disaster risk management and emergency response communities, particularly in emerging countries, were not fully utilizing space-based technology. To support countries in institutionalizing the use of space-based information in all phases of disaster management, UN-SPIDER regularly carries out advisory support activities upon the invitation of a United Nations Member State.","Disaster Management"
"The booklet outlines the advisory support the programme has provided to three Member States: Myanmar, the Dominican Republic and Sri Lanka.","Disaster Management"
"In a first step, UN-SPIDER undertook a one-week-long Technical Advisory Mission (TAM) to each of these countries. Accompanied by a group of experts, it assessed the current use of space-based information in disaster management activities based on exchanges with disaster management and development authorities, United Nations organizations, regional and international organizations as well as private sector entities. Since its establishment in 2006, the programme has conducted 35 such missions. At the end of a TAM, UN-SPIDER makes recommendations to the Member State in areas such as policy and coordination, capacity building and institutional strengthening, and accessing and processing of data.","Disaster Management"
"UN-SPIDER typically conducts a number of follow-up activities after a TAM, which can take a variety of forms such as stakeholder meetings, workshops or training sessions. In Sri Lanka, for instance, UN-SPIDER conducted four trainings on topics such as ""Space Technology for Improving Hazard Mapping"" and ""Earth Observation Technologies for Flood Risk Mapping, Modelling and Management"" following its TAM in 2011. It also worked together with the Disaster Management Centre (DMC) of Sri Lanka to support it in becoming an Authorized User of the International Charter ""Space and Major Disasters"" in 2017. For the its activation for latest floods in the country in May 2018, the Charter nominated the DMC as project manager.","Disaster Management"
"In the Dominican Republic, UN-SPIDER's 2010 TAM was followed by an Institional Strengthening Mission (ISM) to elaborate the terms of reference for the Inter-institutional Geospatial Information Team (EIGEO), which was established in 2013. The EIGEO team brings together professionals from 14 ministries, government agencies, universities and NGOs who have been trained by UN-SPIDER in the use of geographic information systems (GIS) and remote sensing applications. In 2017, the International Charter nominated the team as project manager for its activation for Hurricane Irma.","Disaster Management"
"In its advisory support activities, UN-SPIDER draws on the expertise of its network of 22 Regional Support Offices (RSOs). Argentina's National Commission on Space Activities (CONAE), for instance, conducted a training for the EIGEO team in the Dominican Republic, which was facilitated by UN-SPIDER. Regional Support Offices, such as the International Water Management Institute (IWMI) in Sri Lanka, have also worked closely together with local disaster management authorities to respond to emergency situations. By making their expertise available for UN-SPIDER activities, RSOs support the programme in implementing its mandate. Through a country-based perspective on UN-SPIDER's activities, the booklet highlights how long-term engagement with relevant stakeholders in a Member State can facilitate the institutionalization of the use of space-based information in disaster management while strengthening technical capacity and ensuring the state has access to existing international emergency reponse mechanisms.","Disaster Management"
"The booklet can be accessed online and downloaded [here](https://reliefweb.int/sites/reliefweb.int/files/resources/UN-SPIDER-2018-Advisory-Support.pdf).","Disaster Management"
"2nd November, 2017 Weather Forecasting Staff of the National Weather Forecasting Office are receiving much needed high resolution modeling from the Indonesian Meteorological Service (BMKG). At a one day training session held at the Tanoa Dateline Hotel the Director of the Tonga Meteorological Service, Mr. ‘Ofa Fa’anunu gave a short brief of the assistance. “The project we are implementing here in Tonga since last week and completing this week is assistance being provided by our Indonesian counterparts to 5 Pacific Island Countries namely Tonga, Vanuatu, Solomon Islands, Samoa and Fiji through funding from the UNESCAP. Tonga is the first country to implement the project. Two specialists from the Indonesian Weather Service (BMKG) are here to assist us install and run a high resolution model at the Forecasting Centre at Fua’amotu. The 2 experts include Chief of the Forecasting Centre in Indonesia, Mr. Agie Wandala Putra and Systems Administrator, Mr. Zainal Abidin.”","Disaster Management"
"Fa’anunu added, ”One of the forecasting difficulties we have today in Tonga is the forecasting of heavy rain. Especially heavy rain associated with thunderstorms and heavy rain associated with low pressure systems which usually gives intense rainfall and problems of flooding of low lying areas in Tonga. Improving forecast of heavy rainfall events will assist us with our response and readiness for such events.","Disaster Management"
"Starting last week these experts from Indonesia have helped us parameterize and install the high resolution Weather Research and Forecast (WRF) model for Tonga. This model downscales the global weather model we use for forecasting here in Tonga called the GFS model (22km resolution) down to 7km and 2.3km resolution.","Disaster Management"
"In plane language its like zooming down from looking at rainfall amount over a 22km area to just 7km and 2.3km areas. We expect that this project will improve our forecasting of high rainfall intensity events.","Disaster Management"
"Finally, The Director of Meteorology wanted to thanks the development partners for their Assistance. “ I would like to take this opportunity to thank the Indonesian Government through the BMKG as well as UNESCAP for this timely and significant assistance to Tonga. We expect that the project will make vast improvements to our Early Warning System and in building community resilience to extreme rainfall events”","Disaster Management"
"The training continues tomorrow at the forecasting center at Fua’amotu completes this Friday 3rd November 2017.","Disaster Management"
"For further information: Meteorology Division on 35355 or metstaff@met.gov.to. More information is also available at www.met.gov.to","Disaster Management"
"Following are UN Deputy Secretary-General Amina Mohammed’s remarks on building resilience to natural hazards, including tsunamis, and the need to reduce disaster risk for the Sustainable Development Goals, as prepared for delivery in New York today:","Disaster Management"
"I thank the Government of Japan and my colleagues at UNISDR [United Nations Office for Disaster Risk Reduction] and UNDP [United Nations Development Programme] for organizing this important discussion.","Disaster Management"
"This year in the Caribbean and on the American mainland, hurricanes have left millions of people in need of assistance.  The Secretary-General recently travelled to Antigua and Barbuda and Dominica to show solidarity and see for himself the damage.","Disaster Management"
"In Puerto Rico, 3.4 million people have been scrambling for basic necessities, including food and water.  Barbuda was rendered uninhabitable and Dominica was hit hard for the second year in a row.  Across the globe, floods in Bangladesh, India and Nepal have affected some 40 million people.  Twenty countries have also declared drought emergencies in the past 18 months, with major displacement taking place across the Horn of Africa.","Disaster Management"
"In light of such impacts, and the growing influence of climate change, which is increasingly exacerbating them, one conclusion is clear: sustainable development and the achievement of the SDGs [Sustainable Development Goals] will remain elusive or significantly delayed so long as hazards are left unchecked.","Disaster Management"
"It is difficult to maintain social and economic progress if development gains are so regularly and profoundly wiped out.  Clearly, more must be done.  We need to build a new generation of infrastructure that is risk-informed, and that in turn underpins resilient economies, communities and livelihoods.  We must also rebuild differently, and better.","Disaster Management"
"This is not a new suggestion.  For years, the international community has called for the need to invest in disaster risk reduction.  As outlined in the Sendai Framework for Disaster Risk Reduction, we need to shift from managing disasters to preventing disasters by better managing existing risks.  This means tackling risk drivers such as poverty, rapid urbanization, weak governance, the decline of ecosystems, desertification and climate change.  These are all driving up disaster risk around the world.","Disaster Management"
"It also means investing appropriately in structural and non-structural measures to prevent and prepare for worst-case scenarios.  In this area, we have seen some success.  Thanks to the efforts of Member States, supported by the United Nations and other development partners, there has been a decline in mortality in relation to most natural hazards in recent years, particularly storms and floods.  In places where strong building codes are observed there has been a decline in mortality from earthquakes.","Disaster Management"
