"In Afghanistan, nearly 7,000 full-time social mobilizers and supervisors are the face of the polio programme in urban areas and instrumental in building trust and demand for vaccination in their communities. Prior to campaigns, female mobilizers hold women’s courtyard sessions where women in the community gather to drink tea, and information is shared on the importance of vaccination against all vaccine-preventable diseases, exclusive breastfeeding and handwashing practices. During campaigns, these mobilizers are entrusted with tracking missed children due to absence or parental refusal and ensuring they are covered in the ensuing week. On average, 65% of children missed during campaigns due to absence and 30% of children missed due to refusal are vaccinated by mobilizers in their districts between campaigns.","Health"
"In Pakistan, more than 14,000 full-time Community-Based Vaccinators work throughout the month to reach every child in their area with vaccine, and generate demand for routine immunization. Known as ‘Sehat Muhafiz’, or ‘Protectors of Health’, these part-vaccinators, part-social mobilizers are drawn from the communities in which they work, and are supported by  community engagement and mass media strategies highlighting their critical role as health workers. These full-time Sehat Muhafiz are critical to the global eradication effort, targeting more than 2.8 million children under 5 in 417 Union Councils (UCs) in the highest-risk core reservoirs. The results have been strong: since the launch of the CBV model, the proportion of children missed in the highest-risk areas during national campaigns has fallen from 25% in 2014 to 5% in 2017 and 94% of areas are passed by independent monitoring. And the Data Support Centre database shows that CBV’s cover 90% of children missed during campaigns in the following week.","Health"
"A joint WHO-UNICEF training curriculum is being rolled out to ensure vaccinators have strong inter-personal communication skills, with more than 46,500 vaccinators in Afghanistan and 2,500 Area-in-Charges in Pakistan trained to date. Annual KAP studies conducted by Harvard Opinion Research Polling underline this investment in vaccinators. In Pakistan, 74% of caregivers stated that vaccinators are better in 2017 than they were last year, with 70% of respondents saying vaccinators were “very knowledgeable about children’s health” (up from 52% in 2016).","Health"
"These examples of social mobilization approaches are rooted in social data, with strategies driven by outcomes of community-based studies evaluating people’s perceptions about diseases and the benefits of vaccination.  Such social data also helps inform development of broader community microplans, all in efforts to ensure that indeed, no child is left behind.","Health"
"**Yemen: Government health staff are saving lives without salaries in the war-torn country**","Health"
"Thursday, September 28, 2017 — Yemen’s health service is experiencing widespread and critical problems, in part because most public sector health workers received their last regular salary a year ago, international medical organisation Médecins Sans Frontières/Doctors Without Borders (MSF) warned in a report released today. MSF is calling for financial support for government health staff without delay in order to avoid a further deterioration of life-saving medical services in Yemen. ","Health"
"In over two and half years of war, bombs, fighting, mass displacement and the spread of diseases have devastated Yemeni families. For the past year, most of the estimated 1.2 million Yemeni civil servants have received little to no salaries, including tens of thousands of public sector health workers across the country. MSF’s new report, Saving lives without salaries, is based on MSF’s experience in the country and includes the testimonies of MSF and Yemen Ministry of Public Health and Population (MoPHP) medical teams, patients and their families.","Health"
"“People don’t understand that we don’t always have drugs; we need to use our own money to buy the medication”, says a nurse at Al-Khamees health centre in Hodeida Governorate “People shout at us ‘Why are you here?!’” ","Health"
" “The commitment we see every day from government staff is humbling”, says Melissa McRae, MSF’s Medical Coordinator in Yemen. “Working for a year without pay, many are doing whatever possible to keep health services running, however minimally, while wondering how to keep their families fed, clothed and safe. Others have had to seek alternative employment or charge patients for medical care that should be available for free.”","Health"
"This is just part of the dire reality for health workers across the country; enduring the catastrophic effects of war, having seen loved ones die, working in health facilities that are often under attack.","Health"
"The massive ongoing cholera epidemic is a stark example of the consequences of the non-payment of salaries to medical staff. Unpaid salaries are driving the collapse of the already-weak public health system, the backbone of which are the doctors, nurses, midwives and other health personnel.","Health"
"MSF calls for an urgent response from the Yemeni authorities and the international community to ensure that health workers are paid immediately; receiving sufficient remuneration is a life-saving intervention. Not doing so will only accelerate the demise of the health system with fatal consequences. Preventable illnesses and deaths are increasing in Yemen, and this can be partially attributed to the non-payment of salaries for public medics.","Health"
"Médecins Sans Frontières (MSF) is paying the salaries of 1,200 public health staff in the health facilities we manage and support across 10 of Yemen’s governorates, and last year we spent more than £50 million on our projects in the country. But our efforts are just a drop in the ocean.","Health"
"Full report available: https://www.msf.org/sites/msf.org/files/msf-yemen-salaries-lr-def.pdf.","Health"
"Further details on the photos below available [here](https://media.msf.org/CS.aspx?VP3=SearchResult&VBID=24BDQY1PEDZO&SMLS=1&RW=1280&RH=885).","Health"
"To arrange an interview, please contact Hannah Whitcombe on hannah.whitcombe@london.msf.org / 0207 067 4243","Health"
"A delegation led by Abdelbagi Jibril, president of the Darfur Relief and Documentation Centre today handed an open letter to the Director-General of World Health Organisation (WHO), Dr Tedros Adhanom Ghebreyesus, urging him and his organisation to urgently intervene and address the cholera epidemic in Sudan. The letter was signed by 30 human rights and civil society advocates, organisations, and activists.","Health"
"“We wish to kindly draw your attention to the cholera epidemic currently ravaging many parts of the Republic of Sudan and causing the death of thousands of victims, especially in Sudan’s peripheral areas. Since the outbreak of the disease in August 2016, all of Sudan’s 18 states, including the national capital Khartoum and its twin cities Omdurman and Khartoum North (Bahri) are severely affected. The epicentre of the cholera pandemic is now reported in the war-ravaged Darfur region,” the letter states.","Health"
"“All indicators suggest the widespread nature of the disease and the need for urgent intervention by the World Health Organization. Evidence of the existence of this deadly disease in Sudan is that on 1st June 2017, Sudan’s Federal Minster of Health informed the National Assembly “Parliament” about the spread of the disease in many parts of the country and he provided precise figures of the number of confirmed cholera cases registered and the mortalities reported during the period of August 2016 – June 2017. Other independent sources, including the US Embassy in Khartoum and the United Nations International Children's Emergency Fund (UNICEF) confirmed, in two separate occasions, the spread of cholera in Sudan.","Health"
"“Although we believe that the figures indicated by the Government of Sudan (GoS) are conservative and do not reflect the reality on the ground, however, the case fatality rate deduced in June 2017 is over 1.8% of confirmed cholera cases, which is a mortality rate  above the threshold to declare cholera epidemic in a country. According to independent medical practitioners in Khartoum and elsewhere in Sudan, the numbers of confirmed cases of cholera are much higher and the mortality rate in some affected areas has reached over 10% of the declared cholera cases.""","Health"
"The letter calls on the WHO Director-General “to take leadership in addressing the cholera crisis in Sudan, especially in the Darfur region and save the lives of thousands of likely victims that are languishing in miserably camps for internally displaced persons. We particularly appeal to you to call upon the GoS to declare, in no ambiguous terms, the existence of a cholera pandemic in the country. We further call on the WHO to develop emergency plans for intervention to curb the ongoing cholera epidemic in Sudan, taking into consideration the special needs of regions of the country that witness concentration of vulnerable groups in densely populated makeshift settlements with extremely poor health service and sanitation such as Darfur, where environmental and health infrastructures are extremely poor.”","Health"
"1. Abdelbagi Jibril, Darfur Relief and Documentation Centre  ","Health"
"2. Abdelmonim Al-Jak, Sudan Democracy First Group  ","Health"
"4. Afaf Hamed, Women Voice for Peace in Sudan  ","Health"
"5. Ahmed H Adam, Independent Scholar, School of Law, SOAS University of London  ","Health"
"6. The Baroness Caroline Cox, Humanitarian Aid Relief Trust  ","Health"
"7. Ben Bradburn, Darfur Interfaith Network, Washington, DC  ","Health"
"8. Biro Diawara, Centre du Commerce International Pour le Développement  ","Health"
"10. Eileen Weiss, Co-Founder, NY Coalition for Sudan  ","Health"
"12. Eric Cohen, Co-founder, Act for Sudan, Boston, MA, USA  ","Health"
"14. Gene Binde, Concerned Citizens For Change  ","Health"
"15. Hannah Forster, African Centre for Democracy and Human Rights Studies  ","Health"
"16. Rev. Heidi McGinness, Director of Outrech, Christian Solidarity International-USA  ","Health"
"18. Laura Limuli, Coordinator, Brooklyn Coalition for Darfur & Marginalized Sudan  ","Health"
"19. Lauren Fortgang, Never Again Coalition  ","Health"
"20. Lazim Suleiman Elbasha, Skills for Nuba Mountains  ","Health"
"21. Mark C Hacket, Operation Broken Silence  ","Health"
"22. Marty Fromer, Never Again Coalition in Portland, OR  ","Health"
"24. Paul Slovic, Genocide Scholar and Risk Analyst, University of Oregon  ","Health"
"25. Roksana Verahrami, Darfur Women Action Group  ","Health"
"26. Sadig Ali Hassan, Darfur Bar Association  ","Health"
"27. Dr. Samuel Totten, Professor Emeritus, University of Arkansas, Fayetteville  ","Health"
"28. Sharon Silber, Jews Against Genocide  ","Health"
"29. Susan Morgan, Investors Against Genocide, San Francisco  ","Health"
"30. William Rosenfeld, Massachusetts Coalition to Save Darfur, Boston","Health"
"**Situation Overview & General Coordination**","Health"
"I am sending the Manaro Volcanic Eruption ground brief Report Number 2 as updates.","Health"
"PDCCC has convened a meeting yesterday afternoon and continue on the latest updates on volcanic","Health"
"activity given by the VMGD officers, started to develop the logistic and awareness plans.","Health"
"Immediately after the meeting the 3 groups commenced on the Awareness program to North Ambae","Health"
"Area Council which ended in the evening. the Awareness program begins with the simple message","Health"
"of how to be coping with the current alert level 3 volcanic activity in terms of inform them of these","Health"
"unrest activity which can be either increase to level 4 or decrease to level 2 so since we in the","Health"
"emergency situation where people in Ambae and Penama Province should be in the preparedness","Health"
"stages, explained the different levels of dangers from 4 - 5, informed them if the situation is getting","Health"
"worst to worst then they should be already ready to be evacuated to safe places which the PDCCC is","Health"
"now working on, given them the prevention measures given by VMGD, NDMO, Health, Agricultures,","Health"
"Started to developed the Logistic Rescue Plan if it develops further to levels 4 & 5 which we are based","Health"
"on the 10 km radius danger zone of our Ambae Risk map and also on the experience of 2005 Eruption (identified all the safe houses or evacuation centers particularly in further West and Eastern part of","Health"
"Ambae Island, allocated each community to each Evacuated centers, means of transportation and pick","Health"
"up points). Which we will be completed soon and send a copy to our head office.","Health"
"Divided into groups and these groups now continue on with the Awareness program on to West Ambae","Health"
"and South Ambae today after the PDCCC just had a brief meeting this morning and now are deployed.","Health"
"We must to say thank you to our main Partner the Penama Provincial Government on its great","Health"
"assistance on the funding of all these activities since they understand the situation of emergencies where community and Provincial Government can still have resources to funds any activity related to","Health"
"the preparedness stages while the National Government through our office NDMO will be coming to","Health"
"assist when the situation becomes a Disaster where they cannot effort to funds any activity due to their","Health"
"limited resources capacity to meet the situation.","Health"
"Impacts from our communities in 4 Area Councils particularly in North & West Ambae they are not new","Health"
"on the Volcanic eruption issues such as Evacuation or communities displacement since they already","Health"
"experienced it in 2005 as such they are ready and listen to the authority the Penama Provincial","Health"
"Government through its PDCCC on the situation on the volcanic activities.","Health"
"Health Issues, people in West Ambae have been rise some complain on their health negative impacts","Health"
"such as itching (head I raon, throat I sow, sit sit wota,), yes, the Manager for Lolowai Hospital confirmed","Health"
"today that reports has been made but no conformation as wither they coming to Nduidui Health Centre","Health"
"for admission or not so as such the team is dispatching to West Ambae today and they will verified","Health"
"wither its true or not as such no confirm of cases yet until tomorrow.","Health"
"Yesterday evening people in West Ambae have been experienced a small ash fall this is due to","Health"
"strong South East Trade winds however, no signs today.","Health"
"I assume that all for now and more up dates will be coming tomorrow however; I wish to take this","Health"
"opportunity to thank all the PDCCC members and the Penama Provincial Government on this good","Health"
"cooperation and great support so far until recently.","Health"
"Thank you all for your continuous support.","Health"
"Yellow fever is caused by a virus, which is transmitted to humans by the bite of an infected specific type of mosquito.","Health"
"The signs and symptoms of Yellow fever include fever, headache, jaundice (yellowness of the eyes and body), muscle pain, nausea, vomiting, and fatigue. In severe cases, bleeding may occur from the mouth, nose, eyes or stomach. In most cases, symptoms disappear after three to four days. The disease has similar symptoms with common illnesses like malaria, common cold etc. The general public is advised to report promptly to the nearest health facility if you notice any of the above signs, as the signs of serious illness can lead to death.","Health"
"The disease can be prevented with the Yellow fever vaccine, which is available in health facilities and confers lifelong protection. Although there is no specific medicine to treat the disease, intensive supportive care can be provided with most patients recovering with appropriate care.","Health"
"To reduce the spread of Yellow fever in the country, the Nigeria Centre for Disease Control advice as follows:","Health"
"•  Ensure that you get vaccinated against Yellow fever. A single dose of Yellow fever vaccine, which is included in Nigeria’s routine immunization schedule given at nine-months is free and sufficient to confer lifelong protection.","Health"
"•  Use insecticides or insect repellent to avoid mosquito bites","Health"
"•  Wear protective clothing to reduce mosquito bites","Health"
"•  Destroy breeding grounds of mosquitoes by eliminating standing water and shade in your environment.","Health"
"•  Sleep under a long-lasting insecticide-treated net","Health"
"NCDC toll-free number: 0800-970000-10              ","Health"
"SMS 08099555577                                              ","Health"
"Twitter/Facebook: @NCDCgov                  ","Health"
"SIGNED                                        ","Health"
"**Abuja, 15 March 2018** - “When I received the confirmation of the first case of Lassa fever and request by  Nigeria Center for Disease Control to coordinate the contact tracing pillar of the outbreak, nothing prepared me for the tasks ahead other than my work in polio eradication, knowing that another responsibility beckons,”  said Mrs Faith Ireye, WHO State Coordinator in Edo state.","Health"
"“The confirmation on 05 January 2018 was reminiscent of the day that the first Ebola virus was reported in 2014 and the Country office in Abuja deployed some of us to assist with contact tracing in Lagos state.” ","Health"
"From 01 January to 04 March 2018, a total of 1,121 suspected cases of Lassa fever have been reported in across 18 states (Edo, Ondo, Bauchi, Nasarawa, Ebonyi, Anambra, Benue, Kogi, Imo, Plateau, Lagos, Taraba, Delta, Osun, Rivers, FCT, Gombe and Ekiti).  Of these, 353 are confirmed positive, 8 are probable, 723 are negative and 37 are awaiting laboratory results. Since the onset of the 2018 outbreak, there have been 110 deaths: 78 in positive-confirmed cases, 8 in probable cases and 24 in negative cases. Case Fatality Rate in confirmed and probable cases is 23.8%. ","Health"
"Deputy Governor of Edo State, His Excellency Philip Shaibu said, “WHO as we all know is one of the pillars that has helped lead surveillance in Edo state. Over the years they have been supporting surveillance extensively but in this particular outbreak, WHO was even the first to draw attention to the fact that we need to galvanize resources from all partners, from other parts of the country to ensure that things get done”.","Health"
"Edo state was one of the hardest hit by the outbreak that required a major response.","Health"
"“Nothing prepared me more for the task than my experiences in polio eradication activities, such as surveillance, supplemental and routine immunization,” said Ms Ireye, who has worked with the Polio Eradication Initiative for over 10 years. “My experiences in polio eradication activities allowed me to immediately swing into action. So, when the outbreak was confirmed, I realized the need to use my expertise to serve communities at risk in the state.”","Health"
"Faith Ireye is one of over 2500 WHO and 390,000 ad hoc personnel supporting polio eradication in Nigeria. On several instances, polio workers have provided frontline support for outbreak response. For example, polio workers were essential to containing the Ebola virus outbreak in 2014. For the Lassa fever response, 271 are involved in active case search, 235 in contact tracing and 320 in community sensitization activities in the 18 states active states.","Health"
"“The polio infrastructure was originally designed towards achieving the polio eradication goals,” said Dr Wondimagegnehu Alemu, WHO Country Representative to Nigeria. “Now polio infrastructure has expanded its support to broader disease surveillance strengthening, outbreak response and basic health care services including immunization.”","Health"
"With the imminent eradication of polio globally, plans are underway to determine how best to transition polio assets including health workers to retain their knowledge and skills.","Health"
"**Experienced network of personnel-gain for public health**  ","Health"
"Dr Fiona Braka, EPI Team Leader for WHO Nigeria, noted that besides helping with vaccinations, polio workers performed other functions critical to containing outbreaks such as Lassa fever, Yellow Fever, Cholera and Meningitis. ","Health"
"“Polio personnel are assisting with case identification, reporting, detailed investigation and contact tracing and community sensitization in the Lassa fever response,” Dr Braka said. ","Health"
"Other activities include data collation, analysis, reporting and archiving using mobile phones fashioned after the real-time tracking and reporting by polio vaccination teams. These activities fit into the polio essential functions of surveillance, outbreak response and containment that vaccine-preventable disease surveillance and laboratory networks rely on to save millions of lives threatened by diseases such as yellow fever and meningitis.","Health"
"“The polio teams on ground in the states were crucial for mounting the initial response to the Lassa fever outbreak and have continued to be WHO’s frontline technical support to the NCDC, States Ministry of Health and local government area teams”, Dr Emmanuel Musa, WHO Incident Manager for Lassa fever Management Team in Nigeria observed.","Health"
"Huge investments by donors and partners have gone beyond polio eradication to saving lives and impacting positively on people’s health. WHO and other partners are currently supporting the National transition plan development to ensure these investments are not wasted, but made available to support other National public health efforts and priorities. ","Health"
"“We must carefully consider how we transition many of the polio workers and the polio infrastructure to help with managing other health needs,” Dr Alemu said. “Future funding and partnerships will be a key part of this work.” ","Health"
"Support for immunization to the Government of Nigeria through WHO, is made possible by funding from the Bill & Melinda Gates Foundation, Department for International Development, European Union, Gavi, the Vaccine Alliance, Global Affairs Canada, Government of Germany, through KfW Bank, Japan International Cooperation Agency, Korea Foundation for International Healthcare,  Measles and Rubella Initiative through United Nations Foundation, Rotary International, United States Agency for International Development, United States Centre for Disease Control and Prevention and  World Bank.","Health"
"Dr Fiona Braka; Tel: +234 703 170 5252; Email:  brakaf@who.int  ","Health"
"For Additional Information or to Request Interviews, Please contact:  ","Health"
"• During week 11, a total of three (3) new suspect meningitis cases including one (1) death were reported from Torit county. All the new cases are from Imurok payam, the most recent locus of transmission. ","Health"
"• Hence, as of 17 March 2018, a total of 171 suspect meningitis cases including 31 deaths (CFR 18.13%) have been reported from lyire and Imurok payams, Torit county. ","Health"
"• Imurok payam has the highest cumulative attack rate (cases per 100,000) of 987. ","Health"
"• The weekly attack rate (cases per 100,000) for Torit county in week 11 is 1.86, which is below the alert and action threshold for meningitis. ","Health"
"• The age-specific attack rates (cases per 100,000) showed that the risk of disease increased with age with persons aged 30 years and above being the most affected (182). ","Health"
"• While most deaths occurred in Imurok payam (22 deaths), the case fatality rates were highest in lyire payam (39.1%). The CFR was highest in persons 5-14 years. ","Health"
"• At least 14 CSF samples have been collected from Torit with the preliminary analysis showing the CSF was clear, cell counts not done, evidence of contamination, 9 (69%) showed Gram positive diplococci, rapid pastorex was negative for all the seven samples tested, and microbiological culturing either showed no growth or evidence of contamination. ","Health"
"• On 14 Mar 2018, the 14 CSF samples were shipped to Institute Pasteur, Paris, France for further testing. ","Health"
"• Coordination meetings, case surveillance at facility and active cases search at community level, case management, and social mobilisation are ongoing.","Health"
"[New data](https://ecdc.europa.eu/en/publications-data/tuberculosis-surveillance-and-monitoring-europe-2018) released on 19th March 2018 by the European Centre for Disease Prevention and Control (ECDC) and the WHO Regional Office for Europe show that the decreasing trend in new tuberculosis (TB) cases, observed since 2007, continues at a rate of around 4% annually in EU/EEA. The rate of the decrease needs to at least double to reach the Sustainable Development","Health"
"Goals target of ending the epidemic of TB by 2030.","Health"
"In the EU/EEA, the rate of notified multidrug-resistant (MDR TB) cases has remained unchanged since 2012, at 0.3 per 100 000  population. However, the proportion of extensively drug-resistant (XDR-TB) cases among MDR-TB cases increased from 13.9%  to 20.6% during the same period, which could be attributed to better capacity for detection. Such capacity is being further developed by ECDC through a pilot project launched in 2017 on the use of whole genome sequencing (WGS) technology to","Health"
