"“It is vital to take on a long-term outlook to address malnutrition in the Sahel,” said Noël Zagré, UNICEF Regional Nutrition Advisor for West and Central Africa. “Efforts need to be intensified to build the resilience of families through improved food security, prevention and treatment of severe acute malnutrition, access to water and sanitation, and knowledge of key family practices such as breastfeeding.”","Food and Nutrition"
"The 2017 SMART survey was conducted in Mali by the National Institute for Statistics (INSTAT) with the Ministry of Health and Public Hygiene, with support from UNICEF, the World Food Programme, the Food and Agriculture Organization of the United Nations, and the World Health Organisation.","Food and Nutrition"
"Download photos and B-Roll on WeShare: https://weshare.unicef.org/Folder/2AMZIFIJ6VAG","Food and Nutrition"
"UNICEF works in some of the world’s toughest places, to reach the world’s most disadvantaged children. Across 190 countries and territories, we work for every child, everywhere, to build a better world for everyone.","Food and Nutrition"
"For more information about UNICEF and its work for children, visit www.unicef.org","Food and Nutrition"
"Follow UNICEF on [Twitter](http://twitter.com/UNICEF) and [Facebook](https://www.facebook.com/unicef)","Food and Nutrition"
"**For more information, please contact:**","Food and Nutrition"
"Eliane Luthi, UNICEF Mali, + 223 75 99 93 11, eluthi@unicef.org","Food and Nutrition"
"Thierry Delvigne-Jean, UNICEF West and Central Africa, +221 33 831 0862 tdelvignejean@unicef.org","Food and Nutrition"
"Christopher Tidey, UNICEF New York, +1 917 340 3017, ctidey@unicef.org","Food and Nutrition"
"Presentation at the NiEWG Meeting on 7th October, 2016      ","Food and Nutrition"
"• Borno and Yobe states are the most affected states in the North East by the Boko Haram (BH) crises with over 90% of the internally displaced people located in the two states are living in the host community (DTM report December 2015)","Food and Nutrition"
"• The prevalence of global acute malnutrition in both states are very high at 11.5% and 10.9% respectively for Borno and Yobe thus requiring urgent humanitarian attention with the understanding that children suffering from severe acute malnutrition (SAM) are nine times more likely to die than their healthy peers without SAM (Preliminary NNHS SMART Survey Results, 2015 and HNO, 2016 • The increasing prevalence of SAM and food insecurity in NE Nigeria with other challenges highlights the basis for this intervention.","Food and Nutrition"
"• Through an integrated approach, AAH, UNICEF and WFP are addressing the basic nutritional needs and strengthening the food security of vulnerable populations in a selected number of LGAs in Borno and Yobe States.","Food and Nutrition"
"• To reduce severe child malnutrition through improving quality and increasing coverage of basic nutrition services and reducing households food insecurity and poverty through cash-based transfers (CBT) to maximize impact of nutrition-specific interventions.","Food and Nutrition"
"• To strengthen the treatment and prevention of acute malnutrition through increasing the coverage of Infant and young child feeding interventions, micronutrients supplementation for children below the age of five years, pregnant and lactating women as well as provision of social protection support for the most vulnerable families.","Food and Nutrition"
"Aggressive scale of services with over 1,700 emergency nutrition sites providing lifesaving nutrition services all over the country.  ","Food and Nutrition"
"Nutrition cluster partners have been able to signicantly scale-up the response, providing more than 441,256 acute malnourished children, including 156,048 severely so (double compared to last year same time), with lifesaving treatment.  ","Food and Nutrition"
"Nutrition cluster partners have also reached an additional 434,433 women and children with nutrition preventive services, bringing the total of people reached since the start of the year to 875,689. This is the highest ever achieved in any given year in Somalia.","Food and Nutrition"
"The nutrition situation in Somalia remains critical and further deteriorating much more than anticipated as attested with increased new admissions to emergency nutrition sites noted from the months of March to May. Moreover, Assessments and surveys conducted during the period showed a critical GAM rate of 15% to above 30% in some of the surveyed areas.  ","Food and Nutrition"
"To mention few of the surveys conducted in April-June 2017 show GAM levels of;","Food and Nutrition"
"26.4% in Badhan (Sanaag) 23% in Abuduwaq (Galgaduud)","Food and Nutrition"
"19.6% in Hudur (Bokool) 29% in Baidoa IDP (Bay)","Food and Nutrition"
"The pipeline is healthy for now however we anticipate major pipeline break as of Aug/Sep 2017 mainly for MAM management supplies which have decit of 7,002 MT of Plumpy Doz, 6,154 MT of Plumpy Sup and 40,509MT of Super Cereal (CSB+) all estimated to cost about 108 Million USD","Food and Nutrition"
"*ROME/ADDIS ABABA - The heads of the three UN food agencies will visit Ethiopia to highlight the critical food and nutrition security situation. Consecutive climate shocks have resulted in back-to-back droughts, which have caused hunger to soar and malnutrition rates to rise to alarming levels. The agency chiefs will discuss how best to strengthen their support to the Government and its systems so that Ethiopia can continue meeting its development goals while simultaneously addressing humanitarian challenges along the way.*","Food and Nutrition"
"The UN Food and Agriculture Organization (FAO)’s Director-General José Graziano da Silva, the International Fund for Agricultural Development (IFAD)’s President Gilbert F. Houngbo and the World Food Programme (WFP)’s Executive Director David Beasley will be in Ethiopia from 1-4 September.","Food and Nutrition"
"In the worst-affected parts of the country, in the south and south-east, rains have failed for the third consecutive year. More than 8.5 million people require food assistance in the second half of 2017. The response led by the Government has begun to stabilize the situation, however additional efforts and support is urgently needed to prevent the situation deteriorating further.","Food and Nutrition"
"The agency heads will witness first-hand the scale of the crisis during a field mission to Somali region where the drought has killed many heads of livestock, causing a breakdown in pastoral livelihoods and a jump in malnutrition. The trio will meet drought-affected people who are receiving food rations, visit nutrition centres treating malnourished children and see distributions of essential support to keep the remaining livestock alive.","Food and Nutrition"
"The current food security and nutrition crisis cannot be resolved by emergency assistance alone. The longer-term solution lies in building communities’ resilience to better withstand shocks and avoid being plunged back into crisis. In Tigray region, the agency chiefs will see the dividends of investing in resilience. They will visit communities where the agencies’ complementary projects have boosted productivity, strengthened livelihoods and improved nutrition. ","Food and Nutrition"
"In Addis Ababa, the three representatives will hold high-level discussions with Government representatives, and UN and other partner organizations, on the life-saving response and the need for greater collaboration and investment in resilience. ","Food and Nutrition"
"Journalists are invited to attend a press briefing to be held at the conclusion of the visit.  ","Food and Nutrition"
"FAO: @GrazianoDaSilva   @FAOnews   @FAOAfrica  ","Food and Nutrition"
"Tamiru Legesse +251 911861293  Tamiru.Legesse@fao.org   ","Food and Nutrition"
"Edward Ogolla +251 935986410  Edward.Ogolla@fao.org ","Food and Nutrition"
"Joanne Levitan +251 988141897/+39 3665620977  j.levitan@ifad.org ","Food and Nutrition"
"Leighla Bowers +251 115 172 131/+251 091 151 3817 Leighla.Bowers@wfp.org  ","Food and Nutrition"
"Peter Smerdon +254 707 622 104 Peter.Smerdon@wfp.org","Food and Nutrition"
"July 2017 was a hazardous month with flood, riverbank erosion, landslide, lighting, massive rainfall, tornado, boat/trawler capsize and fire. Following the devastating flood on middle of April, a new flood started on 27 June affecting two northeast districts Sylhet and Moulvibazar which continued in July. Also, from July 02 flood started in eight districts, namely: Rangpur, Kurigram, Serajganj, Jamalpur, Bogra, Lalmonirhat, Gaibandha, Nilphamari and southern district Cox’s Bazar.","Food and Nutrition"
"Moreover, the depression originated in the Bay of Bengal caused heavy rainfall in the coastal regions which triggered landslides in three districts under the Chittagong Hill Tracts i.e. Bandarban, Chittagong and Cox’s Bazar.","Food and Nutrition"
"[Horn of Africa - Complex Emergency Fact Sheet #9, Fiscal Year (FY) 2017](https://reliefweb.int/node/2197904)","Food and Nutrition"
"Presentation at the NiEWG Meeting on 7th October, 2016      ","Food and Nutrition"
"• Borno and Yobe states are the most affected states in the North East by the Boko Haram (BH) crises with over 90% of the internally displaced people located in the two states are living in the host community (DTM report December 2015)","Food and Nutrition"
"• The prevalence of global acute malnutrition in both states are very high at 11.5% and 10.9% respectively for Borno and Yobe thus requiring urgent humanitarian attention with the understanding that children suffering from severe acute malnutrition (SAM) are nine times more likely to die than their healthy peers without SAM (Preliminary NNHS SMART Survey Results, 2015 and HNO, 2016 • The increasing prevalence of SAM and food insecurity in NE Nigeria with other challenges highlights the basis for this intervention.","Food and Nutrition"
"• Through an integrated approach, AAH, UNICEF and WFP are addressing the basic nutritional needs and strengthening the food security of vulnerable populations in a selected number of LGAs in Borno and Yobe States.","Food and Nutrition"
"• To reduce severe child malnutrition through improving quality and increasing coverage of basic nutrition services and reducing households food insecurity and poverty through cash-based transfers (CBT) to maximize impact of nutrition-specific interventions.","Food and Nutrition"
"• To strengthen the treatment and prevention of acute malnutrition through increasing the coverage of Infant and young child feeding interventions, micronutrients supplementation for children below the age of five years, pregnant and lactating women as well as provision of social protection support for the most vulnerable families.","Food and Nutrition"
"Aggressive scale of services with over 1,700 emergency nutrition sites providing lifesaving nutrition services all over the country.  ","Food and Nutrition"
"Nutrition cluster partners have been able to signicantly scale-up the response, providing more than 441,256 acute malnourished children, including 156,048 severely so (double compared to last year same time), with lifesaving treatment.  ","Food and Nutrition"
"Nutrition cluster partners have also reached an additional 434,433 women and children with nutrition preventive services, bringing the total of people reached since the start of the year to 875,689. This is the highest ever achieved in any given year in Somalia.","Food and Nutrition"
"The nutrition situation in Somalia remains critical and further deteriorating much more than anticipated as attested with increased new admissions to emergency nutrition sites noted from the months of March to May. Moreover, Assessments and surveys conducted during the period showed a critical GAM rate of 15% to above 30% in some of the surveyed areas.  ","Food and Nutrition"
"To mention few of the surveys conducted in April-June 2017 show GAM levels of;","Food and Nutrition"
"26.4% in Badhan (Sanaag) 23% in Abuduwaq (Galgaduud)","Food and Nutrition"
"19.6% in Hudur (Bokool) 29% in Baidoa IDP (Bay)","Food and Nutrition"
"The pipeline is healthy for now however we anticipate major pipeline break as of Aug/Sep 2017 mainly for MAM management supplies which have decit of 7,002 MT of Plumpy Doz, 6,154 MT of Plumpy Sup and 40,509MT of Super Cereal (CSB+) all estimated to cost about 108 Million USD","Food and Nutrition"
"*ROME/ADDIS ABABA - The heads of the three UN food agencies will visit Ethiopia to highlight the critical food and nutrition security situation. Consecutive climate shocks have resulted in back-to-back droughts, which have caused hunger to soar and malnutrition rates to rise to alarming levels. The agency chiefs will discuss how best to strengthen their support to the Government and its systems so that Ethiopia can continue meeting its development goals while simultaneously addressing humanitarian challenges along the way.*","Food and Nutrition"
"The UN Food and Agriculture Organization (FAO)’s Director-General José Graziano da Silva, the International Fund for Agricultural Development (IFAD)’s President Gilbert F. Houngbo and the World Food Programme (WFP)’s Executive Director David Beasley will be in Ethiopia from 1-4 September.","Food and Nutrition"
"In the worst-affected parts of the country, in the south and south-east, rains have failed for the third consecutive year. More than 8.5 million people require food assistance in the second half of 2017. The response led by the Government has begun to stabilize the situation, however additional efforts and support is urgently needed to prevent the situation deteriorating further.","Food and Nutrition"
"The agency heads will witness first-hand the scale of the crisis during a field mission to Somali region where the drought has killed many heads of livestock, causing a breakdown in pastoral livelihoods and a jump in malnutrition. The trio will meet drought-affected people who are receiving food rations, visit nutrition centres treating malnourished children and see distributions of essential support to keep the remaining livestock alive.","Food and Nutrition"
"The current food security and nutrition crisis cannot be resolved by emergency assistance alone. The longer-term solution lies in building communities’ resilience to better withstand shocks and avoid being plunged back into crisis. In Tigray region, the agency chiefs will see the dividends of investing in resilience. They will visit communities where the agencies’ complementary projects have boosted productivity, strengthened livelihoods and improved nutrition. ","Food and Nutrition"
"In Addis Ababa, the three representatives will hold high-level discussions with Government representatives, and UN and other partner organizations, on the life-saving response and the need for greater collaboration and investment in resilience. ","Food and Nutrition"
"Journalists are invited to attend a press briefing to be held at the conclusion of the visit.  ","Food and Nutrition"
"FAO: @GrazianoDaSilva   @FAOnews   @FAOAfrica  ","Food and Nutrition"
"Tamiru Legesse +251 911861293  Tamiru.Legesse@fao.org   ","Food and Nutrition"
"Edward Ogolla +251 935986410  Edward.Ogolla@fao.org ","Food and Nutrition"
"Joanne Levitan +251 988141897/+39 3665620977  j.levitan@ifad.org ","Food and Nutrition"
"Leighla Bowers +251 115 172 131/+251 091 151 3817 Leighla.Bowers@wfp.org  ","Food and Nutrition"
"Peter Smerdon +254 707 622 104 Peter.Smerdon@wfp.org","Food and Nutrition"
"[Horn of Africa - Complex Emergency Fact Sheet #6, Fiscal Year (FY) 2017](https://reliefweb.int/report/somalia/horn-africa-complex-emergency-fact-sheet-6-fiscal-year-fy-2017)","Food and Nutrition"
"Mozambique achieved some hunger targets under Millennium Development Goal 1, but challenges remain in terms of Sustainable Development Goal 2, particularly with regard to chronic malnutrition rates and vulnerability to natural disasters, which are among the highest worldwide.","Food and Nutrition"
"WFP’s country strategic plan (2017–2021) draws on the findings from the zero hunger strategic review, lessons learned and consultations with stakeholders. It focuses on WFP’s areas of strength that add value to the national zero hunger agenda and prioritizes support for government programmes and institutions, even when WFP plays an operational role. WFP will maintain its humanitarian assistance capacity while supporting long-term resilience and work to address the underlying causes of food insecurity and malnutrition. A gender and nutrition lens will be applied throughout the portfolio.","Food and Nutrition"
"The following strategic outcomes will be addressed:","Food and Nutrition"
"i) Households in food-insecure areas of Mozambique are able to maintain access to adequate and nutritious food throughout the year, including in times of shock.","Food and Nutrition"
"ii) Shock-affected people in Mozambique are able to meet their basic food and nutrition needs during and immediately after a crisis.","Food and Nutrition"
"iii) Children in chronically food-insecure areas have access to nutritious food throughout the year.","Food and Nutrition"
"iv) Targeted people in prioritized areas of Mozambique have improved nutrition status in line with national targets by 2021.","Food and Nutrition"
"v) Targeted smallholder farmers in northern and central Mozambique have enhanced livelihoods by 2021.","Food and Nutrition"
"vi) Humanitarian and development partners in Mozambique are reliably supported by efficient and an effective supply chain and information and communications technology services and expertise.  ","Food and Nutrition"
"WFP’s main partners are the Government, the Food and Agriculture Organization of the United Nations, the International Fund for Agricultural Development, the United Nations Children’s Fund, the United Nations Population Fund, UN-Women and non-governmental organizations.  ","Food and Nutrition"
"The country strategic plan is aligned with the Government’s Vision 2025 and its Five-Year Plan (2015–2019), which are integrated with the Mozambique United Nations Development Assistance Framework (2017–2020), and contributes to WFP Strategic Results 1, 2, 3 and 8 in the WFP Strategic Plan (2017–2021).","Food and Nutrition"
"*MAPUTO –The United Nations World Food Programme (WFP) has launched its five-year Country [Strategic Plan (CSP)](https://reliefweb.int/report/mozambique/mozambique-country-strategic-plan-2017-2021) for Mozambique.  The plan is designed to ensure that people have more reliable and nutritious food to eat, and to make them more resilient to the climate shocks to which Mozambique is increasingly prone.*","Food and Nutrition"
"The CSP for Mozambique – one of a series of new strategic plans initiated by WFP in countries around the world – is aligned to the [United Nations Sustainable Development Agenda](http://www.un.org/sustainabledevelopment/development-agenda/) for the year 2030, to transform the planet into a place free of poverty and inequality. The product of two years of nationwide consultations, the Strategic Plan fully supports Mozambique’s key national development priorities, including the Government’s Five Year Plan 2015-19. ","Food and Nutrition"
"“This Strategic Plan is an important milestone for the country,” said Karin Manente, Country Director in Mozambique. “It lays out the steps needed for WFP to work with the Government and other partners in addressing the main challenges to food and nutrition security in Mozambique.”","Food and Nutrition"
"In addition to ensuring that vulnerable people can meet their food and nutrition needs, even in times of crisis, the CSP focuses on eradicating malnutrition among children in chronically f00d-insecure areas and improving the livelihoods of smallholder farmers. ","Food and Nutrition"
"Despite Mozambique achieving its Millennium Development Goal of halving the number of hungry people in the country, nearly a quarter of its people face chronic food insecurity or malnourishment. The country remains one of the most disaster-prone countries in the world - highly vulnerable to extreme climatic events which destroy infrastructure and restrict economic growth, undermining attempts to eradicate poverty and hunger. While maintaining strong humanitarian assistance capacity, WFP’s new plan focuses on supporting longer-term resilience-building efforts, as well as strengthening partnerships, national systems and institutions needed to achieve the [Sustainable Development Goals](http://www.undp.org/content/undp/en/home/sustainable-development-goals.html), in particular SDG 2 (Zero Hunger) by 2030. ","Food and Nutrition"
"The Country Strategic Plan for Mozambique, budgeted at US$ 167 million, was approved and came into effect in July. ","Food and Nutrition"
"WFP is the world's largest humanitarian agency fighting hunger worldwide, delivering food assistance in emergencies and working with communities to improve nutrition and build resilience. Each year, WFP assists some 80 million people in around 80 countries.","Food and Nutrition"
"Follow us on Twitter @wfp_mozambique, @wfp_media; ","Food and Nutrition"
"For more information please contact (email address: [firstname.lastname@wfp.org](https://reliefweb.int/mailto:firstname.lastname@wfp.org)):  ","Food and Nutrition"
"Tomson Phiri, WFP/Maputo, Tel. +258 21 482 2244, Mob. +258 84 746 3909  ","Food and Nutrition"
"Milton Machel, WFP/Maputo, Tel.  +258 21 482 2244, Mob.  +258 82 319 6150","Food and Nutrition"
"VIENTIANE – Today, the Lao PDR Ministry of Health, jointly with the United Nations World Food Programme (WFP), launched the country’s first Fill the Nutrient Gap report. The report confirmed that despite significant progress, Lao PDR has some of the highest rates of malnutrition in South East Asia, with more than one third of children under five (35.6 percent) suffering from stunting or chronic malnutrition.  ","Food and Nutrition"
"The Fill the Nutrient Gap report contains an analysis of the nutrition situation in Lao PDR, compares the potential impact of interventions, and identifies programme and policy entry points to ensure consumption of an adequately nutritious diet.  ","Food and Nutrition"
"“This report supports the implementation of the National Nutrition Strategy, Plan of Action to reduce the levels of chronic malnutrition to 25% by 2025,” said the Minister of Health, Associate Prof. Dr. Syhavong Bounkong, “good nutrition in the first 1000 days of life is vital to meet these goals”. ","Food and Nutrition"
"The first 1,000 days refers to the ‘window of opportunity’ from a child’s conception through to her second birthday. Inadequate nutrition during this time can irreversibly hamper cognitive and physical development.","Food and Nutrition"
"Key findings show that while nutritious food is available across the country, many people cannot afford it. In fact, the cost of a nutritious diet varies significantly across the country, and the report shows that when people can’t afford a basic staple diet, stunting rates are higher. Furthermore, it is more expensive to give adolescent girls and pregnant and breastfeeding women an adequate diet, because they need specific, more nutritious food. ","Food and Nutrition"
"“While great progress has been made over recent years in Lao PDR to decrease levels of chronic malnutrition, the report highlights the challenges on the road ahead. The recommendations made in the report will assist the country to work towards the elimination of all forms of malnutrition and meet the Sustainable Development Goal targets,” said Sarah Gordon-Gibson, WFP Country Director and Representative. ","Food and Nutrition"
"The report provides a detailed review of nutrition, dietary intake, food security, household food expenditure, and socio-economic status of the population. It will facilitate future decision-making by the government and all partners to improve the quality and access to nutritious food, especially during the critical period of the initial 1,000 days of life.","Food and Nutrition"
"The key recommendations include focusing on both nutrition-specific and nutrition-sensitive interventions targeting the initial 1000 days of life. The report also suggests developing strategies to improve nutrient intake of adolescent girls; explore food fortification options; and engage in social behavior change communication. Improved diet diversity and quality of food would result in greater nutritional benefits; however, is only possible through maintaining a high level of political and financial commitment. A technical working group will continue translating the recommendations of this analysis to the appropriate policy and programmatic interventions. ","Food and Nutrition"
"The Fill the Nutrient Gap process included: market data collection in the five provinces of Oudamxay, Phongsaly, Savanakhet, Sekong and Vientiane capital; secondary data analysis; and stakeholder consultations for formulating recommendations.  ","Food and Nutrition"
"WFP is the world's largest humanitarian agency fighting hunger worldwide, delivering food assistance in emergencies and working with communities to improve nutrition and build resilience. Each year, WFP assists some 80 million people in around 80 countries.","Food and Nutrition"
"Follow us on Twitter  @SGordonGibson, @WFPAsia   ","Food and Nutrition"
"For more information please contact:               ","Food and Nutrition"
"World Food Programme: Kathleen Inglis (Kathleen.inglis@wfp.org)","Food and Nutrition"
