"Among them, 44 were imported cases, up 33.33 percent from the same period in 2016. Most of these patients caught the virus in Asian countries such as Thailand, India, Vietnam and Sri Lanka, according to Zhejiang Provincial Health and Family Planning Commission.","Health"
"The remaining 104 cases resulting from local transmission were in the provincial capital Hangzhou. No deaths were reported, the commission said.","Health"
"The costal province has experienced an increase in imported cases.","Health"
"Dengue is a potentially fatal mosquito-borne disease mainly found in tropical and subtropical regions. Symptoms include fever and nausea as well as muscle and joint aches.","Health"
"During the last 08 month of the year 2017, 146527 suspected dengue cases have been reported to the Epidemiology Unit from all over the island. [Latest Disease Trends](http://www.epid.gov.lk/web/index.php?option=com_casesanddeaths&Itemid=448&lang=en)","Health"
"Approximately 44.12% of dengue cases were reported from the Western province. The highest numbers of dengue cases were reported during the 29 week of 2017.","Health"
"This situation warrants regular removal of possible mosquito breeding sites from the environment. It is also important to seek medical attention in the event of fever by day three of the illness.","Health"
"Last Updated on Wednesday, 30 August 2017 10:31","Health"
"On 22 August 2017, the National IHR Focal Point for France notified a confirmed fatal case of yellow fever in a 43-year-old Brazilian woman in French Guiana, with an unknown vaccination status.","Health"
"The patient was hospitalized on 7 August 2017 and died on 9 August 2017 at the Cayenne hospital from fulminant hepatitis. She may have visited a gold mining area near St. Elie (North center of the country). Investigations are currently ongoing in order to identify the patient's travel route.","Health"
"On 21 August 2017, the case was laboratory confirmed at the national reference center for arboviruses, Institut Pasteur Cayenne by RT-PCR. This is the first confirmed case diagnosed in this territory since 1998.","Health"
"In French Guiana, yellow fever is considered endemic. The overall immunization coverage is good as yellow fever vaccination is mandatory but immunization coverage might be low in specific populations like clandestine and illegal workers. Therefore, vaccination catch-up will be implemented in legal and illegal gold prospecting areas.","Health"
"French Guiana health authorities are implementing several public health measures:","Health"
"- An initial investigation was performed and further investigations are ongoing.","Health"
"- Vector control interventions are being implemented, especially in specific zones that the case visited. These include health facilities in Cayenne and Kourou, localities of the interior around Saint Elie, and in the Bas-Oyapock river area.","Health"
"- The feasibility of vaccination catch-up targeting workers in legal and illegal gold mining areas is considered.","Health"
"- Communication and messages on prevention measures for yellow fever are being disseminated in French Guiana, including to people who live in those areas.","Health"
"Yellow fever is an acute viral hemorrhagic disease that has the potential to spread rapidly and cause serious public health impacts in unimmunized populations. Vaccination is the most important means of preventing the infection.","Health"
"French Guiana is considered at risk for yellow fever transmission. A yellow fever vaccination certificate is required for travelers over one year of age. Vaccination coverage in French Guiana is optimal, however, the coverage in some populations such as clandestine workers, in mining areas could be sub-optimal and therefore at risk for yellow fever infections.","Health"
"While the exact place of infection remains under investigation, the most likely geographic area of infection appears to be around the border between French Guiana and Brazil along the Oyapock river.","Health"
"At this stage and according to the preliminary data, this case is not epidemiologically linked to the sylvatic yellow fever outbreaks reported from Brazil since January 2017. Sequencing and comparison with yellow fever virus strains from other countries is needed to understand the potential link between the different outbreaks and the evolution of yellow fever virus. Based on the information currently available regarding epidemiological situation and early public health actions, the potential for large epidemic and international spread exists but is limited and could be further reduced by vaccination.","Health"
"Advice to travelers planning to visit areas at risk for yellow fever transmission in South America includes:","Health"
"- Vaccination against yellow fever at least 10 days prior to the travel. A single dose of yellow fever vaccine is sufficient to confer sustained immunity and life-long protection against yellow fever disease. A booster dose of the vaccine is not needed.","Health"
"- Observation of measures to avoid mosquito bites.","Health"
"- Awareness of symptoms and signs of yellow fever in general population.","Health"
"- Promotion of health care seeking behavior while traveling and upon return from an area at risk for yellow fever transmission, especially to a country where the establishment of a local cycle of transmission is possible (i.e. where the competent vector is present).","Health"
"This case report illustrates the importance of maintaining awareness of the need for yellow fever vaccination, especially in areas with favorable ecosystem for yellow fever transmission.","Health"
"Yellow fever can easily be prevented through immunization provided that vaccination is administered at least 10 days before travel. A single dose of yellow fever vaccine is sufficient to confer sustained immunity and life-long protection against Yellow fever disease and a booster dose of the vaccine is not needed.","Health"
"WHO, therefore, urges Members States to strengthen the control of immunization status of travelers to all potentially endemic areas. Viraemic returning travelers may pose a risk for the establishment of local cycles of yellow fever transmission in areas where the competent vector is present. If there are medical grounds for not getting vaccinated, this must be certified by the appropriate authorities.","Health"
"WHO does not recommend that any general travel or trade restriction be applied on French Guiana based on the information available for this event.","Health"
"During the last 09 month of the year 2017, 154529 suspected dengue cases have been reported to the Epidemiology Unit from all over the island. [Latest Disease Trends,](http://www.epid.gov.lk/web/index.php?option=com_casesanddeaths&Itemid=448&lang=en)","Health"
"Approximately 43.44% of dengue cases were reported from the Western province. The highest numbers of dengue cases were reported during the 29 week of 2017.","Health"
"This situation warrants regular removal of possible mosquito breeding sites from the environment. It is also important to seek medical attention in the event of fever by day three of the illness.","Health"
"In response to the catastrophic earthquake that hit central Mexico on 19 September, AMDA has sent a nurse/coordinator to Mexico City. After arriving in the capital on 22 September, the nurse is schedule to meet up with the staff from Tenrikyo’s local office. Earlier this month, Tenrikyo’s Mexico branch had just finished working with AMDA on the disaster relief for the quake that devastated the country’s southwest. ","Health"
"According to UNOCHA, the death toll across five states has risen to 217, of which 86 of them were killed in Mexico City. It was reported that at least 45 buildings have been collapsed in the city alone. The quake affected medical facilities as well. While hospitals have been trying to maintain their daily operation despite some level of building damage, 39 hospitals were severely affected throughout the country. Mexico has been facing extensive power outage which has affected 38 million people as a whole. It may take time until the power comes back on.","Health"
"A two-year-old girl in Khyber Pakhtunkhwa (KP) has been diagnosed with the polio virus, the province's health department told DawnNews on Thursday.","Health"
"The girl, who belongs to the Lakki Marwat district, had been vaccinated against polio this year. However, her family decided to have her examined after they realised that one of her legs hurt.","Health"
"Health officials say that though she has contracted virus, she will be able to walk normally thanks to her prior vaccination.","Health"
"This is the first polio case that has emerged in KP this year. Last year, [eight cases were reported](https://www.dawn.com/news/1359124/minor-diagnosed-with-polio-virus-in-kp-despite-being-vaccinated) from the province.","Health"
"The total number of polio cases that have emerged in Pakistan this year has now risen to five.","Health"
"Now that the Hurricane Maria has passed, the island’s residents are being confronted with incredible damage and devastation as they look to begin to rebuild their lives and care for the more than 10,000 people in shelters – both local residents and those evacuated from surrounding islands in the wake of to Hurricane Irma.  ","Health"
"Direct Relief has been in communication with the Puerto Rico Department of Health, Office of Public Health Preparedness & Response and has built a shipment of specifically requested medicines and medical supplies to assist in the aftermath of Hurricane Irma. That shipment is scheduled to leave in the coming days once logistical channels are cleared.  ","Health"
"Direct Relief’s contacts at the Emergency Operation Center have gathered initial needs for the different entities responding to the disaster. The EOC is requesting that all donations go through their official channels, which Direct Relief is uniquely positioned to do through its pre-existing representative agent for product clearances, as well as coordination directly with the Department of Health. Two areas have been identified as medical distribution centers for which Direct Relief donations will be targeted.  ","Health"
"Support is designated for two municipal islands of Culebra and Vieques located to the east of Puerto Rico that were affected by Hurricane Irma. Four orders for these municipalities have been consolidated and are ready to ship. In addition, product is also earmarked for both residents and refugees from surrounding Caribbean islands affected by the storm (namely British and U.S. Virgin Islands, St. Martin, St. Thomas). About 2,000 people from these places are being triaged and assessed for their medical needs in Puerto Rico.  ","Health"
"Lastly, Puerto Rico is currently caring for at least 120 dialysis patients that are currently being housed in hotels but will likely be placed in special needs shelters and will require long-term care. Direct Relief is in contact with a physician from the U.S. Public Health Service, in coordination with the EOC, who is putting together a list of insulin needs for those patients. A shipment will be built and sent in the coming week.  ","Health"
"Direct Relief has longstanding relationships with healthcare partners throughout the island, and more than $400,000 in assistance has been sent to those clinics over the past year.","Health"
"The World Health Organization (WHO) and other partners are moving swiftly to help health authorities contain a cholera outbreak in a camp for internally displaced people (IDPs) in north-eastern Nigeria.","Health"
"A total of 69 cases including 5 deaths have been reported so far in the outbreak at Muna Garage, a camp on the outskirts of the state capital Maiduguri which is home to 44 000 people displaced by conflict and famine. The state of Borno is at the heart of a humanitarian crisis in the north-east of the country where almost 7 million people need health assistance and 60% of health facilities are functioning partially or not at all.","Health"
"Detecting and responding rapidly to suspected cases of cholera is vital to controlling outbreaks, which can spread rapidly in areas where access to safe water is limited, hygiene conditions are poor and populations are weakened by food shortages. Intense efforts by national and partner response teams in Borno State over the last year mean surveillance and monitoring capacity have been greatly strengthened, enabling early detection of this outbreak.","Health"
"The State Ministry of Health is leading partners including WHO, in the response to the outbreak in Muna Garage, which includes the establishment of a cholera treatment centre, increasing risk communications and assessing the need for an oral cholera vaccination campaign in the affected area.","Health"
"WHO has prepositioned Inter-agency Diarrheal Disease Kits across the state for immediate response to diarrhea and cholera outbreaks and has trained 56 health workers including doctors, nurses, laboratory technicians and pharmacists on cholera case management, and infection prevention and control (IPC). These health workers are boosting capacity to treat people with the disease in the affected camp and surrounding health facilities.","Health"
"WHO-supported community outreach workers are conducting active case search in the camp to find and refer anyone suffering from the disease that has not been able to seek help at a health facility.","Health"
"The most effective prevention measures against cholera are basic hygiene practices, including use of clean and safe water and proper sanitation. House to house visits are underway in the camp to sensitize people to the risk of cholera, teach them how to prevent and manage diarrhea at home, and educate them on the use of chloride tablets for household water treatment and safe water storage.","Health"
"Sample collection, data management and trend analysis are being implemented by WHO surveillance teams to ensure that the response is not just keeping up with cases but is also tailored to prevent further spread.  Partners are also working to improve water and sanitation conditions in the camps.","Health"
"For Additional Information or to Request Interviews, Please contact:           ","Health"
"***Professor Tony Redmond is Director of The University of Manchester’s Humanitarian and Conflict Response Institute***","Health"
"*MANCHESTER, UK, Sep 21 2017 (IPS)* - Until this week, it had been 32 years since Mexico City suffered its last major earthquake. That was of 8.0 magnitude, which was approximately tenfold greater than Tuesday’s 7.1 magnitude. Over 5000 people died, and outside assistance was offered and received.","Health"
"Much has improved in the local, regional and international responses worldwide since then, particularly in strengthening the local capacity to respond. Mexico is no exception, and will have significant capacity to respond, fully supported by its neighbours and the Pan American Health Organisation’s (PAHO) disaster response.","Health"
"It’s possible that specific outside help, beyond the region may not be asked for, but if it is, the medical help will be through the Emergency Medical Teams system at WHO/PAHO, coordinated through its Emergency Medical Teams Coordination Cell.","Health"
"This will embed with the national ministry of health, and through its online ‘virtual on-site operations coordination centre’, will liaise with those registered international teams who have indicated their willingness to deploy and with government, choose who is best suited to the needs they have identified.","Health"
"This ensures that assistance is targeted on identified need, coordinated, and in the case of medical practitioners, that they are appropriately trained, qualified and can be officially authorised to practice in Mexico.","Health"
"The WHO registration and classification system ensures minimum/core standards are adhered to and that all teams are fully self-sufficient, in order not to add a further burden to the affected country.","Health"
"When thinking about what might be needed to assist, international teams must consider how long it will take to get there and become fully operational. This will shape the type of assistance they can give.","Health"
"For example, lifesaving surgery is done in the first few hours, so surgical assistance that takes days to arrive will be too late for this. However, it can be focused on the further management of complex injuries in the survivors if the local surgical capacity for this has been overwhelmed.","Health"
"Rehabilitation is often overlooked, but providing this type of support can free up beds by facilitating the early discharge of patents and provide much-needed support to them and their families in their homes.","Health"
"Any major disaster diverts health care personnel from their day-to-day tasks, but unrelated emergencies still continue to occur, and other non-disaster related health conditions still require care and treatment. Support to this less glamorous aspect of disaster response and maintaining essential emergency health care is still important to those affected.","Health"
"When thinking about international search and rescue, bear in mind that most victims of earthquakes are rescued by their fellow survivors and some by local and regional teams. Very few are rescued by international teams, as it simply takes them too long to get there.","Health"
"There were hundreds of international search and rescue personnel who responded to the earthquake in Nepal – and they saved 13 people. Everyone else was saved by the Nepalese.","Health"
"*Addressing Global Inequalities is one of The University of Manchester’s research beacons – examples of pioneering discoveries, interdisciplinary collaboration and cross-sector partnerships that are tackling some of the biggest questions facing the planet.*","Health"
"During the last 08 month of the year 2017, 145567 suspected dengue cases have been reported to the Epidemiology Unit from all over the island. [Latest Disease Trends](http://www.epid.gov.lk/web/index.php?option=com_casesanddeaths&Itemid=448&lang=en)","Health"
"Approximately 44.18% of dengue cases were reported from the Western province. The highest numbers of dengue cases were reported during the 29 week of 2017.","Health"
"This situation warrants regular removal of possible mosquito breeding sites from the environment. It is also important to seek medical attention in the event of fever by day three of the illness.","Health"
"*Last Updated on Tuesday, 29 August 2017 09:27*","Health"
"(Intercepted from Macau Daily) Vice President of the Macau Red Cross Central Council Chou Kuok Hei and Eliza Y L Cheung, representative of Hong Kong Red Cross, denoted that both regional Red Cross Societies have started their post-disaster psychological support, which includes hotline inquiries, home visits, and psychological counseling talks. When a psychological counseling is in session, volunteers from both places will be in attendance. The aim is to take good advantage of the Hong Kong professionals’ expertise, while pairing with Macau volunteers’ familiarity of local culture. Such perfect match can provide better service to the needy individuals, and greatly elevate the case success rate.","Health"
"Both of them expressed that after the storm, the support work was in full swing. While the frontline relief volunteers have to pacify the victims, synchronously they have to deal with their own homes which were impacted by the disaster. Such dual pressure can easily make them very emotional. Therefore, since last week, Macau Red Cross started the psychological counseling lectures for the frontline volunteers, and they are expected to take care of themselves while serving others.","Health"
"At least 24 people have died of cholera across Darfur this week, with reports continuing to reach Radio Dabanga of new infections in the region.","Health"
"Eight people died of cholera and 13 others have been infected in Murnei locality of West Darfur until Tuesday.","Health"
"A sheikh from camp Murnei for displaced persons told Radio Dabanga that five deaths occurred after the patients were transferred to the camp’s isolation centre on Saturday, while another three died on Sunday.","Health"
"He said the camp recorded 13 new cases of cholera on Monday and Tuesday, with 28 people languishing in hospital.","Health"
"Reports reaching Radio Dabanga from Zamzam camp south of El Fasher, capital of North Darfur record five new cholera infections on Monday","Health"
"This was announced to Radio Dabanga by sheikhs and activists in voluntary work at the camp.","Health"
"On Sunday one of the camp sheikhs told Radio Dabanga that five of these were basic school pupils.","Health"
"He said that the pupils were transferred to El Fasher Hospital because of the closure of the medical isolation centre for cholera in the camp, and called on the health authorities in the state to expedite reopening it.","Health"
"The Nierteti medical isolation centre in Central Darfur recorded two new cases of cholera on Tuesday.","Health"
"A medical source told Radio Dabanga from Nierteti Hospital that the new cases are patients who were transferred to the centre from the camp for the displaced in Nierteti.","Health"
"On Monday, there were nine cholera patients in the hospital.","Health"
"Three displaced people have died and more than 45 others infected by an as yet unknown disease that is spreading in the camps for the displaced at Sirba locality in West Darfur.","Health"
"The coordinator of Sirba camps told Radio Dabanga that a disease that has not yet been diagnosed began to spread at Sirba, Tanjaki, and Bir Kilab two weeks ago.","Health"
"He explained that among the symptoms of the disease are fever, vomiting and diarrhoea.","Health"
"He said the disease led to the death of three people at camp Bir Kilab on Sunday and Monday.","Health"
"He pointed out that Sirba hospital received about 45 patients.","Health"
"He said the hospital nurses diagnosed the disease as a normal fever, but pointed out that there was no doctor at the hospital and questioned whether the disease was a common fever.","Health"
"He appealed to the health authorities to move to diagnose the disease, dispense the appropriate medication, and treat the patients.","Health"
"Lassa fever is an acute viral haemorrhagic fever illness that is known to be endemic in various West African countries including Nigeria. As of 9 June 2017, a total of 501 suspected cases including 104 deaths have been reported since the onset of the current Lassa fever outbreaks season in December 2016. Of the reported cases, 189 have been further classified, 175 laboratory-confirmed including 59 deaths and 14 probable cases (all dead).","Health"
"During the current Lassa fever outbreak, 17 Nigerian states (Anambra, Bauchi, Borno, Cross-River, Ebonyi, Edo, Enugu, Gombe, Kaduna, Kano, Kogi, Nasarawa, Ogun, Ondo, Plateau, Rivers, and Taraba) have reported at least one confirmed case. As of 9 June 2017, the outbreak is still active in 9 states (Anambra, Bauchi, Cross-River, Edo, Taraba, Nasarawa, Ondo, Plateau, and Kano).","Health"
"The ongoing outbreak response is focused at State and federal levels and involves coordination of weekly Lassa fever review meeting in conjunction with World Health Organization, United States Centers for Disease Control and Prevention, the University of Texas Medical Branch (UTMB), and the African Field Epidemiology Network.","Health"
"The following response measures are being carried out:","Health"
"- Enhanced surveillance is ongoing in all affected states and Lassa fever cases are reported to the federal level and contact tracing is ongoing in affected states with an active outbreak through the state surveillance team.","Health"
"- The line listing of cases reported across all the states is ongoing and data are uploaded in the VHF database.","Health"
"- Lassa fever treatment centers have been established in the affected states to support case management. These centers are supplied with case management as well as infection prevention and control supplies.","Health"
"Lassa fever is an acute viral haemorrhagic fever illness. Lassa fever is transmitted to humans via contact with food or household items contaminated with rodent urine or faeces. Person-to-person infections and laboratory transmission can also occur. Lassa fever is endemic in Nigeria and other West African countries and causes outbreaks almost every year in different parts of the region, with yearly peaks observed between December and June.","Health"
"Overall, the current risk assessment for Lassa fever outbreak in Nigeria shows a declining trend of outbreaks. Considering this, ongoing response measures remains focused on preparedness and response in general and further risk of large scale outbreaks is not very high. However, a close follow up, active case searching, contact tracing, laboratory support and disease awareness (in the community and for health care workers) should remain ongoing. Although there is constant population movement between these Nigerian states, a large-scale disease transmission or outbreak spread has not been reported. However, there have been sporadic cases reported in Togo and Benin originating from Nigeria.","Health"
"Prevention of Lassa fever relies on promoting good “community hygiene” to discourage rodents from entering homes. In health-care settings, staff should always apply standard infection prevention and control precautions when caring for patients, regardless of their presumed diagnosis.","Health"
